5093,"New pain-sensing organ discovered in skin, claim scientists","Sweden's Karolinska Institutet scientists have claimed to have found a new pain-sensing, meshlike organ in the skin that senses dangerous environmental stimuli. The organ is built from specialised glial 'Schwann' cells located below the skin's outer layer and is sufficient and required for initiation of mechanical pain transduction, researchers said. ""It's a two-cell receptor organ,"" they added.",ANI,"Washington D.C. [USA], Aug 16 (ANI): Researchers have discovered a new sensory organ that is able to detect painful mechanical damage such as pricks and impacts.Researchers at Karolinska Institutet have discovered this new sensory organ in the skin that is sensitive to hazardous environmental irritation. It is comprised of glia cells with multiple long protrusions and which collectively go to make up a mesh-like organ within the skin.According to the study published in the journal -- Science -- this organ is sensitive to painful mechanical damage such as pricks and pressure.The study described what the new pain-sensitive organ looks like, how it is organised together with pain-sensitive nerves in the skin and how activation of the organ results in electrical impulses in the nervous system that result in reflex reactions and experience of pain.Pain causes suffering and results in substantial costs for society. Almost one person in every five experiences constant pain and there is a considerable need to find new painkilling drugs.However, sensitivity to pain is also required for survival and it has a protective function. It prompts reflex reactions that prevent damage to tissue, such as pulling your hand away when you feel a jab from a sharp object or when you burn yourself.The cells that make up the organ are highly sensitive to mechanical stimuli, which explain how they can participate in the detection of painful pinpricks and pressure. In experiments, the researchers also blocked the organ and saw a resultant decreased ability to feel mechanical pain.""Our study shows that sensitivity to pain does not occur only in the skin's nerve fibers, but also in this recently-discovered pain-sensitive organ,"" said Patrik Ernfors, professor at Karolinska Institutet's Department of Medical Biochemistry and Biophysics and chief investigator for the study. ""The discovery changes our understanding of the cellular mechanisms of physical sensation and it may be of significance in the understanding of chronic pain,"" added Prof Ernfors. (ANI)",https://www.aninews.in/news/health/researchers-claim-to-have-discovered-a-new-pain-organ-in-skin20190816191221/?utm_campaign=fullarticle&utm_medium=referral&utm_source=inshorts
5096,Taliban says killing of leader's brother will not affect US talks,"Afghan Taliban officials said on Saturday the killing of the brother of their leader Haibatullah Akhundzada in a bomb attack in Pakistan would not affect talks with the US. ""If someone thinks martyring our leaders would stop us from our goal they're living in a fool's paradise,"" it added. There has been no claim of responsibility for the bomb blast.",Reuters,"PESHAWAR, Pakistan/KABUL (Reuters) - Afghan Taliban officials said on Saturday the killing of the brother of their leader in a bomb attack would not derail talks with the United States aimed at securing the withdrawal of U.S. troops after 18 years of war. There was no claim of responsibility for the bomb that killed the younger brother of Taliban leader Haibatullah Akhundzada near the Pakistani city of Quetta on Friday. It came after both Taliban and U.S. officials have reported progress in talks on an agreement centered on a U.S. troop withdrawal from Afghanistan in exchange for a Taliban security guarantee. “If someone thinks martyring our leaders would stop us from our goal they’re living in a fool’s paradise,” a Taliban leader said by telephone from an undisclosed location. “We are close to our goals,” he said, referring to the talks with the United States. He declined to be identified. The militants have been fighting to expel foreign forces and set up an Islamic state since they were ousted in October 2001, weeks after the Sept. 11 attacks on the United States. Both U.S. negotiators and the Taliban have reported progress after eight rounds of talks since late last year but the violence has not eased. The bomb at the mosque near Quetta killed four people, and wounded 20, Pakistani police said. The Taliban leader’s brother, Hafiz Ahmadullah, was leading prayers when it exploded. One of the leader’s sons was wounded, Taliban officials said. Pakistani police confirmed that one of the dead was identified as Hafiz Ahmadullah but said they could not confirm if he was a brother of the Taliban leader. Pakistan denies accusations that it supports the Taliban but many members live there. In the Afghan capital, Kabul, a suicide bomber attacked a Saturday night wedding reception. An interior ministry spokesman said there were tens of casualties, both wounded and dead. There was no claim of responsibility. U.S. President Donald Trump has made no secret of his desire for a U.S. pullout from Afghanistan and an end to America’s longest war. Top U.S. national security advisers briefed Trump on Friday on the negotiations. There are deep concerns among Afghan officials and U.S. national security aides about the talks led by U.S. special representative to Afghanistan, Zalmay Khalilzad, who updated Trump. A U.S. pullout has raised fears Afghanistan could plunge into a new civil war that could see a return of Taliban rule and give international militants a sanctuary. Under the expected deal, the Taliban, in exchange for a U.S. commitment on a withdrawal, would guarantee Afghanistan would not be a sanctuary for militants to expand and plot new attacks, both sides have said. The Taliban are also expected to make a commitment to open power-sharing talks with the U.S.-backed government and agree to a ceasefire. Afghan presidential spokesman Sediq Seddiqi told a news briefing any deal had to include a ceasefire and a U.S. withdrawal would be based on conditions. A second Taliban official, speaking from Doha, where the Taliban have a political office and where the talks have been held, said preparations were being made for a meaningful final round. “We’ve solved most issues,” said the official, who also declined to be identified. No date has been set for more talks. The Taliban were considering a ceasefire in places from which U.S. forces withdraw, the second official said. Some 14,000 U.S. troops remain in Afghanistan, training and advising Afghan security forces and conducting counterinsurgency operations. The war has ground into a stalemate with casualties rising among civilians as well as combatants. Additonal reporting by Orooj Hakimi in KABUL; Writing by Robert Birsel; Editing by Stephen Powell and Marguerita Choy",https://www.reuters.com/article/us-usa-afghanistan/taliban-say-killing-of-leaders-brother-will-not-derail-u-s-talks-idUSKCN1V70CJ?utm_campaign=fullarticle&utm_medium=referral&utm_source=inshorts
5097,May God ruin Trump: US lawmaker Tlaib's 90-year-old grandmother,"After US lawmaker Rashida Tlaib rejected Israel's offer to let her travel to the West Bank to visit her family on ""humanitarian grounds"", her 90-year-old grandmother said, ""Trump tells me I should be happy Rashida is not coming...May God ruin Trump."" Trump had tweeted, ""The only real winner here is Tlaib's grandmother. She doesn't have to see her now!""",Reuters,"BEIT UR AL-FAUQA, West Bank (Reuters) - Sitting under an olive tree in the Israeli-occupied West Bank, Muftia Tlaib scoffs at the attention she has recently received from the president of the United States.     “May God ruin him,” she says.  Tlaib is the grandmother of U.S. congresswoman Rashida Tlaib, at the center of an affair that has drawn Donald Trump and Israeli Prime Minister Benjamin Netanyahu together against U.S. Democrats. On Thursday, bowing to pressure from Trump, Israel barred a visit by Rashida Tlaib and fellow Democrat Ilhan Omar that it had initially said it would allow. The next day, Israel said it would let Tlaib visit her family in the West Bank on humanitarian grounds - but Tlaib rejected the offer, saying that Israel had imposed restrictions meant to humiliate her.. On Friday night, Trump tweeted:  “Rep. Tlaib wrote a letter to Israeli officials desperately wanting to visit her grandmother. Permission was quickly granted, whereupon Tlaib obnoxiously turned the approval down, a complete setup. The only real winner here is Tlaib’s grandmother. She doesn’t have to see her now!” Ninety-year-old Muftia Tlaib, sitting in her garden in the village of Beit Ur Al-Fauqa, was not impressed. “Trump tells me I should be happy Rashida is not coming,” she said. “May God ruin him.” Her son, Rashida’s uncle Bassam Tlaib, said the women had not seen each other since 2006: “She was going to slaughter a sheep when Rashida arrived and prepare her favorite food, stuffed vine leaves. “Rashida sees her granny as a second mother, she has always supported her. Rashida says she owes her success to her grandmother.” Tlaib did not outline what the conditions imposed on her visit were. Israeli media reported that she had agreed not to promote boycotts against Israel as part of her request to Israel’s Foreign Ministry. Tlaib, like Omar, has voiced support for the pro-Palestinian Boycott, Divestment, Sanctions (BDS) movement, which opposes the occupation and Israel’s policies toward Palestinians in the West Bank and Gaza. BDS backers can be denied entry to Israel by law. The pair are the first two Muslim women to be elected to Congress, and Detroit-born Tlaib is the first Palestinian-American congresswoman. Both are members of the Democratic party’s progressive wing and sharp critics of Trump and Israel. The Palestinians want to establish a state in the West Bank, East Jerusalem and the Gaza Strip, territories Israel captured in the 1967 Middle East war.  Israel has annexed East Jerusalem in a move not recognized internationally; maintains a blockade of Gaza, run by the Islamist Hamas movement; and controls most of the West Bank, where Palestinians have limited self-rule. The prospects of resolving the conflict under the “two-state solution” that had guided peacemaking efforts for years have dimmed significantly since Trump took office, while Israeli settlements on land Palestinians seek for a state have expanded. The Trump administration, which is particularly close to the Netanyahu government, has touted its own peace plan but details remain vague. It fueled Palestinian anger by recognizing disputed Jerusalem as Israel’s capital in 2017. Trump has for weeks been attacking Tlaib and Omar, along with lawmakers Alexandria Ocasio-Cortez of New York and Ayanna Pressley of Massachusetts - all women of color known as the “Squad” - accusing them of hostility to Israel in a barrage condemned by critics as racist.  “Trump has told Rashida and Ilhan to go back to their home countries. What a contradiction, yesterday he asked them to leave and today he asks that they aren’t let in,” said Bassam Tlaib. Still, the grandmother is hopeful: “My heart tells me that she will come.”(The story is refiled to fix typo in paragraph nine.) Writing by Maayan Lubell; Editing by Kevin Liffey",https://www.reuters.com/article/us-israel-palestinians-usa/may-god-ruin-trump-tlaibs-grandmother-says-idUSKCN1V70EL?utm_campaign=fullarticle&utm_medium=referral&utm_source=inshorts
5098,Govt says probing jump in refined palm oil imports from Malaysia,"The Commerce Ministry said it has initiated a probe into whether a jump in refined palm oil shipments from Malaysia is causing serious injury to the domestic industry. Malaysian exports of refined palm oil to India jumped 727% in the first half of 2019 to 1.57 million tonnes, according to data compiled by the Malaysian Palm Oil Board (MPOB).",Reuters,"MUMBAI (Reuters) - India has initiated a probe into whether a jump in refined palm oil shipments from Malaysia is causing serious injury to domestic industry, the trade ministry’s investigative arm said in a statement. Malaysian exports of refined palm oil to India, the world’s biggest importer of edible oils, jumped 727% in the first half of 2019 to 1.57 million tonnes compared with the same period a year before, according to data compiled by the Malaysian Palm Oil Board (MPOB). Mohd Bakke Salleh, chairman of the MPOB, last month attributed the increase to recent changes in Indian duties. In January, New Delhi cut import duty on refined palm oil shipments to 50% from 54%. Malaysian shipments already attracted only a 45% duty due to the Comprehensive Economic Cooperation Agreement signed by the two countries nearly a decade ago.  Yet the change in duty structure reduced the effective duty difference between crude palm oil (CPO) and refined palm oil for Indian refiners to 5.5 percent from 11 percent for shipments from Malaysia, making overseas buying of refined palm oil more lucrative than CPO. Rising shipments of refined palm oil have hit local refiners, alleges Mumbai-based trade body the Solvent Extractors’ Association of India (SEA), which has filed an application with the Directorate General of Trade Remedies (DGTR) for the investigation. “The Authority prima facie finds that there is sufficient evidence that imports of product under investigation have increased significantly causing serious injury to the domestic producers,” the DGTR said in a statement. The investigative agency has asked interested parties to submit their views within a month. The DGTR has in the past recommended the government raise duties on imports of certain products such as solar cells that were deemed to be hurting local industry.  Reporting by Rajendra Jadhav; Editing by David Holmes",https://in.reuters.com/article/india-malaysia-palmoil-imports/india-says-probing-jump-in-refined-palm-oil-imports-from-malaysia-idINKCN1V70BC?utm_campaign=fullarticle&utm_medium=referral&utm_source=inshorts
5100,Male UFC fighter challenges female UFC fighter to a match,"UFC fighter Henry Cejudo has said that he wants to be the first UFC ""intergender"" champion and challenged female featherweight fighter Valentina Shevchenko to a match. Shevchenko responded to Cejudo, saying, ""Be careful what you wish for."" ""I don't even know how to respond to that,"" UFC President Dana White said about the challenge.",RT,"The very idea might sound like a sinister sporting sequel to ‘The Hunger Games’ set in a dystopian future where genders have finally gelled into an unrecognizable blur - much to the delight of social justice warriors.But it isn’t too far away from reality.Earlier this week Henry Cejudo, the Ultimate Fighting Championship (UFC) bantamweight and featherweight titleholder, issued a callout to the organization’s female flyweight ruler Valentina Shevchenko for a fight to determine the world’s first 'intergender champion'.And why not? If the perennial debate about allowing transgender athletes to perform alongside women, regardless of obvious physical advantages and in spite of worrying anomalies, shows no sign of dying down, why not rip up the rulebook and allow a genderless free-for-all across all sports.While it sounds outlandish and maybe even cruel from Cejudo, his proposal perhaps might be a good thing for sports. The politically correct brigade have consistently campaigned for a complete bypass of factual biological contrasts between men and women to accommodate transgender athletes at the expense of the success of women so vehemently. Why not cut to the chase?Said brigade found it perfectly acceptable for Laurel Hubbard, the New Zealand weightlifter who set national records as a junior male before transitioning to female later in life, to win the gold medal in the 2017 Australian International & Australian Open. This was despite a backlash from fellow athletes who claimed Hubbard’s win was unjust.Only injury prevented the 41-year-old from winning Commonwealth Games gold last year, but this year Hubbard went on to win the 2019 Pacific Games and Oceania Championships, and will keep wiping the floor with competition as long as such glaringly apparent natural biological differences between men and women are controverted.However, when this denial is taken to the extreme and is applied to mixed martial arts, the stakes are gravely raised, and the outcomes would be dark and damning. Would it be ethically correct to allow a man to fight a woman with minimal rules? What if there was a death? And more importantly, why is it any different from allowing men to identify as women and compete alongside them?These questions have come perilously close to being answered in MMA in the case of transgender fighter Fallon Fox who, although having met all all conditions to compete among women, caused an outcry by breaking the skull of Tamikka Brents in a brutal TKO win.After the fight, Brents claimed that despite being an “abnormally strong female in my own right” she had “never felt so overpowered ever in my life” as against US Navy veteran Fox. Major UFC figures condemned Fox, with promotion head honcho Dana White stating: “I don't think someone who used to be a man and became a woman should be able to fight a woman” and then-poster girl Ronda Rousey claiming there was no “undo button” on male puberty.Those views have been held by other sports, notably by all-time tennis great Martina Navratilova. But even coming from the pinnacle of sport down, those claims mostly fall on deaf ears, as the Czech 18-time Grand Slam champion was forced to apologize when she dared to voice her opinion that to allow men to compete with women if they simply “change their name and take hormones” is “unfair.''Unfair might not cut it in MMA, where the logical conclusions and repercussions would be much more severe.On the other hand, should Shevchenko - who has preliminarily accepted the callout for an intergender match - win the fight, the merry band of politically correct fanatics would deem social justice to have been served, flinging open the floodgates for intersex competition across any discipline, maybe even scrapping weight classes and distances altogether in the name of progression.Intergender mixed martial arts fights may seem like stupidity and at best a crass attempt at self-promotion, but they could be closer than we think and if political correctness in sport is pushed to such illogical extremes, it could take a brutal show of force to finally remove any doubt about biological differences between genders.By Danny Armstrong",https://www.rt.com/sport/466649-intergender-mma-champions-debate/?utm_campaign=fullarticle&utm_medium=referral&utm_source=inshorts
5103,Some Muslims not concerned about population explosion: Sena,"The Shiv Sena in its mouthpiece 'Saamana' on Friday alleged that fundamentalist Muslims are not concerned about population explosion and can't come out of the mindset of 'hum do humare pacchis' (we two, our 25 children). Earlier, Prime Minister Narendra Modi in his Independence Day speech had said that choosing to have small families is a form of patriotism.",India.com,"New Delhi: Throwing weight behind Prime Minister Narendra Modi’s bid to control population, Shiv Sena in its mouthpiece ‘Saamana’ recently welcomed the cause- but not without taking some potshots.Targetting a certain section of Muslims, an editorial in the Shiv Sena mouthpiece alleged, “fundamentalist Muslims are not concerned about population explosion and are not ready to come out of the mindset of “hum do humare pacchis” (we two, our 25 children).”In his Independence Day address on Thursday, PM Modi voiced concern over “population explosion”, stating that it leads to many difficulties. He also said that keeping one’s families small is an act of patriotism.The Shiv Sena supported it by saying that late Bal Thackeray always advocated it.“The NDA government under Modi is espousing the policies of the Shiv Sena. This is in national interest,” Shiv Sena MP Sanjay Raut said.Meanwhile, AIMIM chief and Hyderabad MP Asaduddin Owaisi criticised the move and tweeted, “Majority of India is young & productive, but this advantage will only last till 2040. @PMOIndia is clueless about what how to utilise this advantage, so he’s coming up with discarded & intrusive ideas of governance that shirk his own responsibility.”Prime Minister had a word of praise for those who are going for small families. He said that such families are observing a form of patriotism. He said, “Those who follow the policy of small family also contribute to the development of the nation, it is also a form of patriotism.”",https://www.india.com/news/india/shiv-sena-backs-pms-population-control-bid-but-slams-some-fundamentalist-muslims-3748174/?utm_campaign=fullarticle&utm_medium=referral&utm_source=inshorts
5104,Amit Shah approves Cabinet expansion in Karnataka,Bharatiya Janata Party (BJP) President Amit Shah on Saturday approved the expansion of Karnataka Chief Minister BS Yediyurappa's Cabinet. The approval comes almost a month after Yediyurappa was sworn in as the Chief Minister of the state. Yediyurappa was in the national capital on Saturday where he met Shah to finalise the expansion.,Livemint,"A total of 697,948 people have been evacuated so far. But the numbers residing in relief camps have been coming down as people have started to make their way back to their homes. The floods have left a trail of destruction in Karnataka, Maharashtra and Kerala among other parts of the country. In Karnataka, a total of 6.9 lakh hectares of crop has been lost and around 74,685 houses have been damaged.",https://www.livemint.com/politics/news/amit-shah-approves-cabinet-expansion-in-karnataka-1566055452666.html?utm_campaign=fullarticle&utm_medium=referral&utm_source=inshorts
5105,Lucknow's Hazratganj Chauraha renamed to 'Atal Chowk',"The Uttar Pradesh government renamed Lucknow's Hazratganj Chauraha to 'Atal Chowk' on the occasion of former PM Atal Bihari Vajpayee's first death anniversary on Friday. Lucknow Mayor Sanyukta Bhatia said that a draft has been prepared to build a memorial for Vajpayee called 'Atal Smriti Upvan', which will have a statue of Vajpayee, his 51 poems, speeches and other memorabilia.",The Financial Express,"Lucknow city’s iconic Hazratganj Chauraha has been renamed as the ‘Atal Chowk’, in honour of former Prime Minister Atal Bihari Vajpayee. The decision was taken by the Yogi Adityanath government on Friday in memory of Vajpayee, who passed away last year on August 16 at the age of 93 after a prolonged illness. The Hazratganj Chauraha in Lucknow is located in the heart of the city near its major shopping area ‘Hazratganj’. A poster that has been installed at the chowk reads, “On the occasion of the first death anniversary of late Shri Atal Bihari Vajpayee ji, Hazratganj Chauraha has been renamed as ‘Atal Chowk’ from August 16.”Speaking on the decision, Lucknow Mayor Sanyukta Bhatiya told ANI, “A number of councillors were demanding different roads and roundabouts be named after Atal Bihari Vajpayee. However, we were looking something grand enough to fit the stature of the former Prime Minister. It has been decided that most prominent and biggest intersection of Lucknow – Hazratganj Chaurha – will be named after Bharat Ratna Vajpayee.”She further said, “As the Mayor of the city, we have prepared a draft for developing a memorial for him — Atal Smriti Upvan. In this memorial, we plan to place his statue along with his 51 poems, speeches and other memorabilia. We have already started a process for identifying land for this memorial.”Several states had announced the renaming of some places in honour of the former Prime Minister last year. Naya Raipur in Chhattisgarh was renamed as Atal Nagar by the state government in August 2018. Many other BJP-ruled states have announced the decision to rename few other places and institutions after the Bharat Ratna awardee.Several places and colleges were also renamed in Jharkhand after Vajpayee by the state government. The Sahibganj Harbour is now known as the Atal Bihari Vajpayee Harbour Sahibganj. The Medical College Palamu and Professional College Jamshedpur has been renamed as Atal Bihari Vajpayee Medical College, Palamu. The eight-lane road leading to the Kako Math in Dhanbad district from the Government of India building was named as Atal Marg.Get live Stock Prices from BSE and NSE and latest NAV, portfolio of Mutual Funds, calculate your tax by Income Tax Calculator, know market’s Top Gainers, Top Losers & Best Equity Funds. Like us on Facebook and follow us on Twitter.",https://www.financialexpress.com/india-news/lucknows-iconic-hazratganj-chauraha-renamed-as-atal-chowk/1678307/?utm_campaign=fullarticle&utm_medium=referral&utm_source=inshorts
