5272,Twitter leads $100 million funding in Bengaluru's ShareChat,"Bengaluru-based vernacular social networking app ShareChat has raised $100 million in its Series D funding round led by micro-blogging giant Twitter. The funding round saw participation from investors including TrustBridge Partners, Shunwei Capital, Lightspeed Venture Partners, SAIF Capital, among others. Founded in 2015, ShareChat has raised about $223 million to date, as per Crunchbase.",TechCrunch,"Is there room for another social media platform? ShareChat,  a four-year-old social network in India that serves tens of million of people in regional languages, just answered that question with a $100 million financing round led by global giant Twitter .Other than Twitter, TrustBridge Partners, and existing investors Shunwei Capital, Lightspeed Venture Partners, SAIF Capital, India Quotient and Morningside Venture Capital also participated in the Series D round of ShareChat.The new round, which pushes ShareChat’s all-time raise to $224 million, valued the firm at about $650 million, a person familiar with the matter told TechCrunch. ShareChat declined to comment on the valuation.“Twitter and ShareChat are aligned on the broader purpose of serving the public conversation, helping the world learn faster and solve common challenges. This investment will help ShareChat grow and provide the company’s management team access to Twitter’s executives as thought partners,” said Manish Maheshwari, managing director of Twitter India, in a prepared statement.Twitter, like many other Silicon Valley firms, counts India as one of its key markets. And like Twitter, other Silicon Valley firms are also increasingly investing in Indian startups.ShareChat serves 60 million users each month in 15 regional languages, Ankush Sachdeva, co-founder and CEO of the firm, told TechCrunch in an interview. The platform currently does not support English, and has no plans to change that, Sachdeva said.That choice is what has driven users to ShareChat, he explained. The early incarnation of the social media platform supported English language. It saw most of its users choose English as their preferred language, but this also led to another interesting development: Their engagement with the app significantly reduced.“For some reason, everyone wanted to converse in English. There was an inherent bias to pick English even when they did not know it.” (Only about 10% of India’s 1.3 billion people speak English. Hindi, a regional language, on the other hand, is spoken by about half a billion people, according to official government figures.)So ShareChat pulled support for English. Today, an average user spends 22 minutes on the app each day, Sachdeva said. The learning in the early days to remove English is just one of the many things that has shaped ShareChat to what it is today and led to its growth.In 2014, Sachdeva and two of his friends — Bhanu Singh and Farid Ahsan, all of whom met at the prestigious institute IIT Kanpur — got the idea of building a debate platform by looking at the kind of discussions people were having on Facebook groups.They identified that cricket and movie stars were popular conversation topics, so they created WhatsApp groups and aggressively posted links to those groups on Facebook to attract users.It was then when they built chatbots to allow users to discover different genres of jokes, recommendations for phones and food recipes, among other things. But they soon realized that users weren’t interested in most of such offerings.“Nobody cared about our smartphone recommendations. All they wanted was to download wallpapers, ringtones, copy jokes and move on. They just wanted content.”So in 2015, Sachdeva and company moved on from chatbots and created an app where users can easily produce, discover and share content in the languages they understand. (Today, user generated content is one of the key attractions of the platform, with about 15% of its user base actively producing content.)A year later, ShareChat, like tens of thousands of other businesses, was in for a pleasant surprise. India’s richest man, Mukesh Ambani, launched his new telecom network Reliance Jio, which offered users access to the bulk of data at little to no charge for an extended period of time.This immediately changed the way millions of people in the country, who once cared about each megabyte they consumed online, interacted with the internet. On ShareChat people quickly started to move from sharing jokes and other messages in text format to images and then videos.That momentum continues to today. ShareChat now plans to give users more incentive — including money — and tools to produce content on the platform to drive engagement. “There remains a huge hunger for content in vernacular languages,” Sachdeva said.Speaking of money, ShareChat has experimented with ads on the app and its site, but revenue generation isn’t currently its primary focus, Sachdeva said. “We’re in the Series D now so there is obviously an obligation we have to our investors to make money. But we all believe that we need to focus on growth at this stage,” he said.ShareChat, which is headquartered in Bangalore, also has many users in Bangladesh, Nepal and the Middle East, where many users speak Indian regional languages. But the startup currently plans to focus largely on expanding its user base in India, hopefully doubling it in the next one year, he said.It will use the new capital to strengthen the technology infrastructure and hire more tech talent. Sachdeva said ShareChat is looking to open an office in San Francisco to hire local engineers there.A handful of local and global giants have emerged in India in recent years to cater to people in small cities and villages, who are just getting online. Pratilipi, a storytelling platform has amassed more than 5 million users, for instance. It recently raised $15 million to expand its user base and help users strike deals with content studios.Perhaps no other app poses a bigger challenge to ShareChat than TikTok, an app where users share short-form videos. TikTok, owned by one of the world’s most valued startups, has over 120 million users in India and sees content in many Indian languages.But the app — with its ever growing ambitions — also tends to land itself in hot water in India every few weeks. In all sensitive corners of the country. On that front, ShareChat has an advantage. Over the years, it has emerged as an outlier in the country that has strongly supported proposed laws by the Indian government that seek to make social apps more accountable for content that circulates on their platforms. Though it is grappling with some of this issue, too.",https://techcrunch.com/2019/08/15/sharechat-twitter-seriesd/?utm_campaign=fullarticle&utm_medium=referral&utm_source=inshorts
5275,Tamil Nadu Education Minister removes ban on 'caste bands' in schools,"After Tamil Nadu authorities issued a circular banning practice of making students wear wristbands to identify them by their castes, state's School Education Minister KA Sengottaiyan said the circular won't be implemented. ""Whatever practice (of wearing caste bands) exists...shall continue the way it is,"" he stated. Many schools in the state allegedly profiled students based on the band's colour.",The New Indian Express,"CHENNAI: School education minister KA Sengottaiyan said on Thursday that he had asked all education officials not to implement a recent circular issued by the department concerned warning severe action against schools making students wear wrist bands that identify their caste.“Whatever practice exists in Tamil Nadu shall continue the way it is,” he told Express over the phone.The usage of caste bands has been in practice for the last several years, especially in the northern districts of the State.Last year, a few physical education instructors and senior district-level officials were accused of discriminating against students, who wanted to participate in sports events, based on their caste.        The students were allegedly profiled based on the colour of the band they wore. There are also allegations about some schools prohibiting Dalit children from using common plates to eat the midday meals.Sengottaiyan, however, said the circular was issued without his knowledge. He termed it as ‘unnecessary’ and said it was passed ‘just to spark a controversy’. Interestingly, BJP leader H Raja was the first one to oppose the circular. “Preventing students from displaying their ‘religious’ symbols is an anti-Hindu move,” Raja had said on the caste band issue.It was the Adi Dravidar and Tribal Welfare Department that first forwarded the circular to the School Education Department, the minister said.""It was subsequently issued without my knowledge,"" said Sengottaiyan.  The circular was issued on the basis of a representation lodged by 180 trainee IAS officers, who submitted that some schools in Tamil Nadu, made students to wear colour coded wrist bands. These wristbands, which come in shades of red, yellow, green and saffron indicate whether they belong to a ‘lower caste’ or ‘upper caste’ in addition to this, rings and forehead tilak on the head were used as a caste marker.Sengottaiyan, however, denied that this practice exists and said that ""no such thing happens in 99 per cent of the State schools."" It may happen very rarely, but I'm unaware of any such incident in Tamil Nadu, he asserted.",http://www.newindianexpress.com/states/tamil-nadu/2019/aug/16/no-ban-on-usage-of-caste-bands-in-tamil-nadu-schools-education-minister-2019539.html?utm_campaign=fullarticle&utm_medium=referral&utm_source=inshorts
5277,Hong Kong's richest man urges to stop protests in 'name of love',"Hong Kong's richest man, 91-year-old Li Ka-shing, urged a halt to the anti-government protests ""in the name of love"" and asked the public to ""love China, love Hong Kong, love yourself"". In front-page advertisements in local newspapers, the billionaire said, ""Love freedom, love tolerance, love the rule of law"". The advertisements were signed ""a Hong Kong citizen Li Ka-shing"".",Reuters,"HONG KONG (Reuters) - The boss of Hong Kong carrier Cathay Pacific Airways quit on Friday, the highest-profile corporate casualty of unrest roiling the former British colony, after Beijing targeted the airline over staff involvement in mass protests. The corporate upheaval comes ahead of a weekend where further protests are planned, including what could be a large gathering on Sunday that could test whether a movement that has enjoyed broad support can retain it, even as violence escalates. Demonstrators say they are fighting the erosion of the “one country, two systems” arrangement that has enshrined some autonomy for Hong Kong since China took it back from Britain in 1997. Several thousand protesters gathered peacefully at a downtown park on Friday for the “Stand with Hong Kong, Power to the People” rally, which had received police permission. Other protests planned for the weekend do not have police permission.  A rally set for Sunday by the Civil Human Rights Front, which organised million-strong marches in June, has only been allowed permission for an assembly in Victoria Park on Hong Kong island, though not a march, due to safety concerns. The group is appealing against the police decision. A ban on a march in Kowloon’s Hung Hom district on Saturday was overturned on Friday. Ten weeks of confrontations between police and protesters have plunged Hong Kong into turmoil, and present the biggest popular challenge to Chinese President Xi Jinping since he came to power in 2012. Police tactics against protesters have been hardening. Nearly 750 people have been arrested since the protests began in June, and tear gas has frequently been used by police in attempts to disperse protests across the city.     China has likened the increasingly violent protests to terrorism and warned it could use force to quell them, as U.S. President Donald Trump urged Xi meet protesters to defuse the tension. Chinese paramilitary troops have been training this week in Shenzhen, which borders Hong Kong, in a clear warning to the protesters. Hong Kong police reiterated on Friday that they are capable of maintaining law and order on their own. Cathay Pacific, an emblem of the city, was blindsided last week when China’s aviation regulator demanded it suspend staff supporting a movement that has mushroomed from opposition to a legal change in Hong Kong into wider calls for democracy. The abrupt departure of Chief Executive Rupert Hogg, a move the company said was “to take responsibility ... in view of recent events,” shows just how much pressure Beijing is piling on corporate giants and the city as it seeks to snuff out the protests. Cathay became embroiled in the confrontation after one of its pilots was arrested at a demonstration in July. China’s aviation regulator demanded any staff involved or supportive of the protests be removed from duty on flights to or over mainland airspace. The company, whose chairman had initially said, before the demand, that it “wouldn’t dream” of telling staff what to think, later acceded to the request, firing two pilots and saying  “overly radical” staff would be suspended from mainland duties. Hogg said these had been “challenging weeks” for the airline and it was right for him, and the company’s chief customer officer who also abruptly quit, to take responsibility. “Cathay Pacific is fully committed to Hong Kong under the principle of ‘one country, two systems,’” the airline said in a statement. The protests began as opposition to a now-suspended bill that would have allowed suspects to be extradited to mainland China. They have swelled since and demands have broadened. Hong Kong returned from British to Chinese rule in 1997 under a “one country, two systems” formula that promised wide-ranging freedoms denied to citizens in mainland China. Many in the city believe Beijing has been eroding those freedoms. The tenor of clashes intensified this week. Thousands of flights were cancelled amid ugly scenes at the city’s airport, when protesters set upon men they suspected were Chinese agents. At the downtown park, Friday night’s protest was peaceful as demonstrators, ranging from bankers to a retired nurse, held up posters reading “Power to the People”, while police looked on. In Australia, hundreds turned out in Sydney and Melbourne in support of the Hong Kong protesters, with the Australian Broadcasting Corporation reporting some scuffles with pro-Beijing demonstrators in Melbourne. Hong Kong’s richest man, Li Ka-Shing, urged people to “love China, love Hong Kong and love yourself” in newspaper advertisements that marked his first comments on the crisis. But Li, 91, and a fixture of Hong Kong business who founded CK Asset Holdings Ltd and chaired CK Hutchison Holdings, stopped short of explicitly backing the Hong Kong government, as many business leaders have done. He made no reference to supporting the government or its embattled leader, Carrie Lam, in the advertisements, which encouraged freedom, tolerance and the rule of law. “I think the government heard the messages from the protesters loud and clear and is diligently racking their brains now for solutions,” Li said. He warned, “The best cause can lead to the worst results.” Reporting by Felix Tam, Donny Kwok, Twinnie Siu and Farah Master in Hong Kong and Jamie Freed in Singapore; Writing by Tom Westbrook; Editing by Tony Munroe, Clarence Fernandez, Kirsten Donovan",https://in.reuters.com/article/hongkong-protests/hong-kong-tycoon-li-ka-shing-urges-love-in-response-to-growing-protests-idINKCN1V6074?utm_campaign=fullarticle&utm_medium=referral&utm_source=inshorts
5278,Not for sale: Greenland amid reports Trump planning to buy it,"Commenting on media reports that US President Donald Trump has privately discussed with advisors the idea of buying Greenland, the country's foreign minister Ane Lone Bagger said it is open for business but is not for sale. Meanwhile, former Denmark Prime Minister Lars Lokke Rasmussen said on Twitter, ""It has to be an April Fool's joke. Totally out of season.""",Reuters,"COPENHAGEN (Reuters) - Greenland on Friday dismissed the notion that it might be up for sale after reports that U.S. President Donald Trump had privately discussed with his advisers the idea of buying the world’s biggest island. “We are open for business, but we’re not for sale,” Greenland’s foreign minister Ane Lone Bagger told Reuters. Trump is due to visit Copenhagen in September and the Arctic will be on the agenda during meetings with the prime ministers of Denmark and Greenland, an autonomous Danish territory. Talk of a Greenland purchase was first reported by the Wall Street Journal. Two sources familiar with the situation told Reuters that the notion had been laughed off by some advisers as a joke but was taken more seriously by others in the White House. Danish politicians on Friday poured scorn on the idea. “It has to be an April Fool’s joke. Totally out of season,” former prime minister Lars Lokke Rasmussen said on Twitter. “If he is truly contemplating this, then this is final proof, that he has gone mad,” foreign affairs spokesman for the Danish People’s Party, Soren Espersen, told broadcaster DR.  “The thought of Denmark selling 50,000 citizens to the United States is completely ridiculous,” he said. Greenland, a self-ruling part of Denmark located between the North Atlantic and Arctic oceans, is dependant on Danish economic support. It handles its own domestic affairs while Copenhagen looks after defense and foreign policy. “I am sure a majority in Greenland believes it is better to have a relation to Denmark than the United States, in the long term,” Aaja Chemnitz Larsen, Danish MP from Greenland’s second-largest party Inuit Ataqatigiit (IA), told Reuters. “My immediate thought is ‘No, thank you’,” she said.  Prime Minister Mette Frederiksen and Foreign Minister Jeppe Kofod were not available for comment but officials said they would respond later on Friday. The U.S. Embassy in Copenhagen was also not immediately available for comment. “Oh dear lord. As someone who loves Greenland, has been there nine times to every corner and loves the people, this is a complete and total catastrophe,” former U.S. ambassador to Denmark, Rufus Gifford, said in on Twitter. Greenland is gaining attention from global super powers including China, Russia and the United States due to its strategic location and its mineral resources. In May, U.S. Secretary of State Mike Pompeo said Russia was behaving aggressively in the Arctic and China’s actions there had to be watched closely as well. A defense treaty between Denmark and the United States dating back to 1951 gives the U.S. military rights over the  Thule Air Base in northern Greenland. There has been no indication that a Greenland purchase will be on the agenda for Trump’s talks with Danish officials. Martin Lidegaard, senior lawmaker of the Danish Social Liberal Party and a former foreign minister, called the idea “a grotesque proposal” which had no basis in reality. “We are talking about real people and you can’t just sell Greenland like an old colonial power,” he told Reuters.  “But what we can take seriously is that the U.S. stakes and interest in the Arctic is significantly on the rise and they want a much bigger influence,” he added. In 1917 Denmark sold off the then Danish West Indies islands for $25 million to the United States, which renamed them the United States Virgin Islands. Reporting by Nikolaj Skydsgaard, Andreas Mortensen, Stine Jacobsen and Jacob Gronholt-Pedersen; additional reporting by Steve Holland in the United States, Editing by Angus MacSwan",https://www.reuters.com/article/us-usa-trump-greenland/greenland-tells-trump-it-is-open-for-business-but-not-for-sale-idUSKCN1V60AQ?utm_campaign=fullarticle&utm_medium=referral&utm_source=inshorts
5280,Hope you've heard PM 'loud and clear': Chidambaram to Sitharaman,"Senior Congress leader P Chidambaram said he hoped Finance Minister Nirmala Sitharaman and her ""legion of tax officials and investigators"" heard PM Narendra Modi's call for respecting wealth creators ""loud and clear"". PM Modi, during his Independence Day speech on Thursday, said that wealth creators should not be seen with suspicion as wealth creation is a ""great national service"".",The Financial Express,"Senior Congress leader P Chidambaram has welcomed Prime Minister Narendra Modi’s speech delivered on Independence Day from the ramparts of the Red Fort. While top Congress leaders Sonia and Rahul Gandhi did not attend the Independence Day ceremony at the Red Fort, the support from Chidambaram comes as a surprise at a time when the party is locked in a bitter battle with the ruling BJP over the abrogation of Article 370 from Jammu and Kashmir among other issues.Chidambaram’s liberal praise upon the Prime Minister for his speech on the occasion of India’s 73rd Independence Day, however, is specific. The former Finance minister has hailed the PM’s vision on three specifics – population explosion, banning use of single-use plastic and respecting wealth creators. The former Union minister said that all should respect the social charter of PM Modi.“All of us must welcome three announcements made by the Prime Minister on Independence Day. Small family is a patriotic duty, respect wealth creators and shun single-use plastic,” he said in a series of tweets.Chidambaram said that of the three exhortations, the first and second exhortations — small family and make India single-use plastic free, must become people’s movement. “The first and third exhortations must become people’s movements. There are hundreds of dedicated voluntary organisations that are willing to lead the movements at local levels,” he said in another tweet.All of us must welcome three announcements made by the PM on I-Day> Small family is a patriotic duty> Respect wealth creators> Shun single-use plastic— P. Chidambaram (@PChidambaram_IN) August 16, 2019Referring to Modi’s call for respecting wealth creators, Chidambaram said that he is hopeful that Finance Minister Nirmala Sitharaman and her legion of tax officials and investigators heard the Prime Minister’s second exhortation “loud and clear”.Chidambaram’s remarks came a day after PM Modi said in his Independence Day speech that population explosion will cause many problems for future generations and said keeping a small family was also a mark of true patriotism. Talking about the wealth creators, PM Modi said that wealth creation was a great national service. On elimination of single-use plastics, he said that single-use plastic poses a grave threat to the environment and called for a massive campaign to make India single-use plastic free.Get live Stock Prices from BSE and NSE and latest NAV, portfolio of Mutual Funds, calculate your tax by Income Tax Calculator, know market’s Top Gainers, Top Losers & Best Equity Funds. Like us on Facebook and follow us on Twitter.",https://www.financialexpress.com/india-news/pm-modis-independence-day-speech-finds-surprise-backer-in-congress-p-chidambaram-is-all-praise/1677126/?utm_campaign=fullarticle&utm_medium=referral&utm_source=inshorts
5282,Women are such powerful beings: Kirti Kulhari,"Actress Kirti Kulhari said in an interview that ""empowerment sounds like the wrong word to use when it comes to women because you empower someone who is weak."" Kirti added, ""I think women are such powerful beings."" She further said, ""They should just start living with the feeling that they are powerful, super strong and can literally do anything.""",Times Now,"Kirti Kulhari has a strong and encouraging message for women on Indias 73rd Independence Day. The actress feels that women are ""powerful, super strong and can literally do anything that they want to in their life.""""People talk about women empowerment and all. Empowerment sounds like the wrong word to use when it comes to women because you empower someone who is weak. So, while you are perpetuating the idea of empowerment, you are also at the same time telling women that you are weak and you need empowerment. I really don't feel so. I think women are such powerful beings. They are just blessed with so much by nature purely from the virtue of being women,"" Kirti told IANS.Kirti feels, women should feel powerful from within, or else the change will not come. ""I think they (women) should just start living with the feeling that they are powerful, super strong and can literally do anything that they want to in their life. That's the attitude that needs to develop in every woman's mind right from the time they are born. I hope everyone helps them develop this attitude. This is all I would want to say to all the women out there. Go out there and claim the universe because it really is yours and happy Independence Day to all of you out there!"" she said.On the work front, Kirti's latest film Mission Mangal has hit theatres today. The movie, directed by Jagan Shakti, chronicles the story of five female scientists, who are on a mission to send a satellite to Mars. The movie also stars Vidya Balan, Sonakshi Sinha, Taapsee Pannu, Nithya Menen and Akshay Kumar.",https://www.timesnownews.com/entertainment/news/people/article/women-are-such-powerful-beings-mission-mangal-actress-kirti-kulhari-on-what-empowerment-means/469546?utm_campaign=fullarticle&utm_medium=referral&utm_source=inshorts
